<?xml version="1.0" encoding="UTF-8"?>
<!--Sample XML file generated by XMLSpy v2019 rel. 3 (x64) (http://www.altova.com)-->
<yt:PurchaseOrder xmlns:xsi="http://www.w3.org/2001/XMLSchema-instance" xmlns:yt="http://www.yellowtwig.nl/training/xmlxslt" xsi:schemaLocation="http://www.yellowtwig.nl/training/xmlxslt PurchaseOrder.xsd">
	<yt:CreatedOn>1957-08-13</yt:CreatedOn>
	<yt:OrderLines>
		<yt:OrderLine>
			<yt:ProductName>text</yt:ProductName>
			<yt:Quantity>2</yt:Quantity>
			<yt:Price>0</yt:Price>
		</yt:OrderLine>
	</yt:OrderLines>
	<yt:OrderLines>
		<yt:OrderLine>
			<yt:ProductName>text</yt:ProductName>
			<yt:Quantity>2</yt:Quantity>
			<yt:Price>0</yt:Price>
		</yt:OrderLine>
	</yt:OrderLines>
	<yt:OrderLines>
		<yt:OrderLine>
			<yt:ProductName>text</yt:ProductName>
			<yt:Quantity>2</yt:Quantity>
			<yt:Price>0</yt:Price>
		</yt:OrderLine>
	</yt:OrderLines>
	<yt:Priority>Standard</yt:Priority>
</yt:PurchaseOrder>
